{
  "schema": "AI_Netlist_v1",
  "project_name": "Quantum Mind UWB RTLS Anchor v3.0",
  "generated_at": "2026-06-02T14:45:14+00:00",
  "source_prompt": "Design the Quantum Mind UWB RTLS Anchor v3.0 exactly from the provided BOM and manufacturing notes. Use ESP32-S3-WROOM-2 as a socketed module on SK1+SK2 female headers, not soldered directly.\n\nBOM:\nItem,Qty,Reference,Value,Description,Manufacturer,Part Number,Package / Footprint,Critical Placement Distance,Notes\n,,,,,,,,,,\n,,== MODULES ====,,,,,,,,\n1,1,U1,ESP32-S3-WROOM-2-N32R16,WiFi + BLE MCU Module 32MB Flash 16MB OPI-PSRAM IPEX Antenna,Espressif,ESP32-S3-WROOM-2-N32R16,Module (plugs into SK1+SK2),Centered on SK1+SK2 sockets — module edges must align with socket rows,\"NOT soldered to PCB directly. Plugs into SK1+SK2 sockets. GPIO33/34/35/36/37 = PSRAM internal - DO NOT connect externally.\"\n2,1,U2,DWM3000,UWB Transceiver Module IEEE 802.15.4z TWR/TDoA,Qorvo,DWM3000,LGA-28,RF keep-out: 3mm all sides of antenna trace. SMA connector within 15mm.,\"Hybrid power: Pin6(VDD3V3)=3.3V; All other VDD pins=1.8V. VDDIO(Pin21)=1.8V — level shifters required on ALL SPI/GPIO signals.\"\n3,1,U3,HLK-10M05,AC-DC Isolated Power Module 5V 2A 10W,Hi-Link,HLK-10M05,PCB Module,AC section: MIN 8mm from all DC components. Varistor RV1 and fuse F1 within 15mm.,\"Input: 100-240V AC. Output: 5V/2A. UPGRADED from HLK-5M05(5W) — insufficient margin.\"\n,,,,,,,,,,\n,,== ESP32 SOCKET (Removable Module) ==,,,,,,,,\n4,2,SK1-SK2,PinSocket_1x22_P2.54mm,2×22-pin Female Socket (2 rows) for ESP32 Module,Wurth Elektronik,61302211821,Connector_PinSocket_2.54mm:PinSocket_2x22_P2.54mm_Vertical,SK1 and SK2 parallel rows — spacing must exactly match ESP32-S3-WROOM-2 module pin pitch (2.54mm × 22 pins),\"SK1=left row(22pin) SK2=right row(22pin). GPIO33-37 pads MUST NOT be connected.\"\n,,,,,,,,,,\n,,== POWER MANAGEMENT ==,,,,,,,,\n5,1,U4,TPS54331DR,Synchronous Step-Down Converter 3A 3.3V,Texas Instruments,TPS54331DR,SOIC-8,\"C21/C22 MAX 3mm from VIN(Pin8). L1 MAX 5mm from SW(Pin1). C23/C24 MAX 3mm from output rail. R14/R15 MAX 1mm from FB(Pin3). NO GND plane within 20mm radius of SW pin.\",\"R14=10kΩ(GND), R15=31.6kΩ(Vout) → Vout=3.33V. CORRECTED: R15 was 100kΩ → 1.6V output.\"\n6,1,U5,TPS780180200DRV,LDO Regulator 1.8V 200mA (DWM3000 only),Texas Instruments,TPS780180200DRV,SOT-23-5,C25/C26 MAX 2mm from IN pin. C27/C28 MAX 1mm from OUT pin. Place close to DWM3000 VDD pins.,\"1V8_DWM rail: ONLY DWM3000 VDD + TXB0104 VCCB + U7/U13/U14 VCCB. No other loads.\"\n,,,,,,,,,,\n,,== LEVEL SHIFTERS (3.3V ↔ 1.8V) ==,,,,,,,,\n7,1,U6,TXB0104RGYR,4-bit Bidirectional Voltage Translator SPI Bus,Texas Instruments,TXB0104RGYR,VQFN-16,\"MAX 15mm from DWM3000. C29(VCCA) MAX 1mm from Pin1. C30(VCCB) MAX 1mm from Pin16. R20-R23 series resistors MAX 5mm from ESP32 GPIO side. SPI traces equal length ±2mm.\",\"VCCA=3.3V(ESP32 side), VCCB=1.8V(DWM3000 side), OE=GND.\"\n8,1,U7,SN74LVC1T45DBVR,Single-Bit Voltage Translator IRQ: 1.8V→3.3V,Texas Instruments,SN74LVC1T45DBVR,SOT-23-6,\"MAX 10mm from DWM3000 Pin22(IRQ). C33(VCCA/1.8V) MAX 1mm from Pin6. C34(VCCB/3.3V) MAX 1mm from Pin5. Trace to GPIO14 MAX 30mm.\",\"Direction A→B. VCCA=1.8V, VCCB=3.3V, DIR=HIGH.\"\n9,1,U13,SN74LVC1T45DBVR,Single-Bit Voltage Translator EXT_TX: 1.8V→3.3V,Texas Instruments,SN74LVC1T45DBVR,SOT-23-6,\"MAX 10mm from DWM3000 Pin27(EXT_TX). C35(VCCA/1.8V) MAX 1mm from Pin6. C36(VCCB/3.3V) MAX 1mm from Pin5. Trace to GPIO15 MAX 30mm.\",\"Direction A→B. VCCA=1.8V, VCCB=3.3V, DIR=HIGH.\"\n10,1,U14,SN74LVC1T45DBVR,Single-Bit Voltage Translator EXT_RX: 3.3V→1.8V,Texas Instruments,SN74LVC1T45DBVR,SOT-23-6,\"MAX 10mm from DWM3000 Pin26(EXT_RX). C37(VCCA/3.3V) MAX 1mm from Pin6. C38(VCCB/1.8V) MAX 1mm from Pin5. Trace from GPIO16 MAX 30mm.\",\"NEW. Direction A→B. VCCA=3.3V, VCCB=1.8V, DIR=HIGH.\"\n,,,,,,,,,,\n,,== SUPPORT ICs ==,,,,,,,,\n11,1,U8,TPL5010DDCR,Nano-Power Watchdog Timer 60s Timeout,Texas Instruments,TPL5010DDCR,SOT-23-6,No specific distance constraint. Place near ESP32 EN pin to keep reset trace short (<20mm).,\"GPIO45→DONE. Pulse every 30s. Resets ESP32 EN on 60s timeout.\"\n12,1,U9,DS3231SN,Real-Time Clock ±2ppm with Crystal,Maxim / Analog Devices,DS3231SN,SO-8,\"Place near I2C pull-up resistors R12/R13. BAT1(CR2032) within 20mm. SCL/SDA traces MAX 50mm.\",\"I2C 0x68. SDA=GPIO21, SCL=GPIO22. VBAT=CR2032.\"\n13,1,U10,AT24C256C-SSHL,EEPROM 256Kbit I2C,Microchip,AT24C256C-SSHL,SO-8,Place on same I2C bus as U9(DS3231). Within 30mm of U9 preferred.,\"I2C 0x50. Stores anchor XY coordinates. WP=GPIO23.\"\n14,1,U15,W5500,Hardwired TCP/IP Ethernet Controller,WIZnet,W5500,LQFP-48,\"Crystal X1 MAX 10mm from W5500 clock pins. C39-C42(decoupling) MAX 2mm from VCC pins. C43-C44 MAX 5mm. J18(RJ45) on PCB edge — MAX 30mm from W5500. Keep W5500 traces away from UWB RF section MIN 20mm.\",\"SPI2: GPIO39-42. RST=GPIO47, INT=GPIO48.\"\n,,,,,,,,,,\n,,== RELAY DRIVERS ==,,,,,,,,\n15,2,U11-U12,PC817X2CSP9F,Optocoupler 2500V Isolation,Sharp,PC817X2CSP9F,DIP-4,\"MIN 8mm clearance between U11/U12 LED side (MCU) and transistor side (relay). PCB slot/cutout recommended between isolated sections. R16/R17 MAX 5mm from GPIO pins.\",\"U11: GPIO4→K1. U12: GPIO5→K2. CORRECTED from GPIO35/36.\"\n16,4,Q1-Q4,2N7002,N-Channel MOSFET 60V 300mA,ON Semiconductor,2N7002,SOT-23,\"Q3/Q4(relay drivers): MAX 5mm from respective PC817 output pin. Q1/Q2(auto-reset): MAX 5mm from ESP32 EN and GPIO0 pins.\",Q1/Q2=auto-reset. Q3=Relay1 driver. Q4=Relay2 driver.\n,,,,,,,,,,\n,,== RELAYS ==,,,,,,,,\n17,2,K1-K2,G5Q-14-DC5,Relay SPDT 5V Coil 10A Contacts,Omron,G5Q-14-DC5,PCB-THT,\"D2/D3 flyback diodes MAX 5mm from relay coil pins. J3/J4 screw terminals adjacent to K1/K2 (within 10mm). Keep relay section MIN 10mm from RF section.\",\"SPDT: COM+NO+NC. K1=GPIO4 path. K2=GPIO5 path.\"\n,,,,,,,,,,\n,,== PROTECTION ==,,,,,,,,\n18,1,D1,SS34-E3/57T,Schottky Diode 3A 40V Buck Flyback,Vishay,SS34-E3/57T,SMA,MAX 3mm from TPS54331 SW pin(Pin1).,TPS54331 SW node flyback protection.\n19,2,D2-D3,1N5819,Schottky Diode 1A 40V Relay Flyback,Vishay,1N5819,SMA,\"MAX 5mm from relay coil pins K1/K2. D2 parallel with K1 coil. D3 parallel with K2 coil.\",\"CORRECTED from 1N4148 to Schottky.\"\n20,2,D4-D5,1N4148TR,Switching Diode 100V 300mA Auto-Reset,ON Semiconductor,1N4148TR,SOD-323,\"D4 MAX 3mm from GPIO0 pin. D5 MAX 3mm from ESP32 EN pin.\",Auto-reset circuit diodes.\n21,3,D6-D8,SMBJ3.3A,TVS Diode 3.3V 600W ESD,Littelfuse,SMBJ3.3A,SMA,Each TVS MAX 5mm from its respective protected 3.3V rail connection point.,3.3V rail ESD clamping (3 locations).\n22,1,D9,SMBJ1.8A,TVS Diode 1.8V 600W ESD,Littelfuse,SMBJ1.8A,SMA,\"MAX 5mm from DWM3000 VDD pins. Place on 1V8_DWM rail, close to DWM3000.\",1.8V rail (DWM3000 core) ESD clamping.\n23,1,D10,USBLC6-2SC6,USB ESD Protection ±15kV,STMicroelectronics,USBLC6-2SC6,SOT-23-6,⚠ MAX 3mm from USB-C connector J1_USB — mandatory for ESD effectiveness.,Place BEFORE USB signal reaches ESP32.\n24,1,RV1,14D471K,Varistor 470V 14mm AC Surge,Littelfuse,14D471K,14mm Disc,On AC input — L-N parallel connection BEFORE fuse F1. Within 15mm of J1_AC.,\"L-N parallel, BEFORE F1.\"\n25,1,F1,0215001.MXP,Glass Fuse 1A 250V 5×20mm,Littelfuse,0215001.MXP,5×20mm + Holder,First component on L (Line) after J1_AC. Within 20mm of AC input connector.,\"AC input fuse. Holder: Littelfuse 01000063Z\"\n26,1,F2,0ZCJ0050FF2G,PTC Resettable Fuse 500mA 1206,Bel Fuse,0ZCJ0050FF2G,1206 SMD,On USB VBUS line — between USB-C connector and FB1. MAX 10mm from connector.,USB VBUS overcurrent protection.\n27,3,FB1-FB3,BLM18PG221SN1D,Ferrite Bead 220Ω@100MHz,Murata,BLM18PG221SN1D,0603,\"FB1: on USB VBUS rail, MAX 10mm from F2. FB2: on 3V3 rail before DWM3000 section. FB3: on 5V rail before relay section.\",\"FB1=USB, FB2=3V3→DWM3000, FB3=5V→relays.\"\n,,,,,,,,,,\n,,== PASSIVE — INDUCTORS ==,,,,,,,,\n28,1,L1,CDRH104R-220NC,Power Inductor 22µH 3A,Sumida,CDRH104R-220NC,10×10mm,⚠ MAX 5mm from TPS54331 SW pin(Pin1). Place on direct path SW→L1→output caps.,Buck converter inductor — current loop must be tight.\n,,,,,,,,,,\n,,== PASSIVE — CRYSTAL ==,,,,,,,,\n29,1,X1,25MHz / 18pF,SMD Crystal 25MHz 3.2×2.5mm,TXC,7B-25.000MAAJ-T,3.2×2.5mm SMD,⚠ MAX 10mm from W5500 clock pins(X1/X2). Load caps C_X1A/C_X1B MAX 2mm from crystal pins. Keep away from high-current traces.,\"W5500 reference clock. Load caps: 2× 18pF.\"\n,,,,,,,,,,\n,,== PASSIVE — CAPACITORS ==,,,,,,,,\n30,4,C1-C4,10µF/50V Electrolytic,Capacitor Electrolytic Radial Bulk,Nichicon,UWX1H100MCL1GB,Radial THT,Near power entry points. MAX 15mm from each power rail input.,General bulk capacitors at power rails.\n31,8,C5-C12,100nF/50V X7R 0805,Ceramic Capacitor Decoupling,Murata,GRM21BR71H104KA01L,0805,⚠ MAX 5mm from each IC VCC pin — mandatory for HF decoupling effectiveness.,One per VCC pin on every IC.\n32,4,C13-C16,10µF/16V X5R 0805,Ceramic Capacitor ESP32 Power,Murata,GRM21BR61C106KE15L,0805,MAX 3mm from ESP32 VDD pin groups (SK1/SK2 power pins).,ESP32 VDD pin group bulk decoupling.\n33,4,C17-C20,1µF/16V X7R 0603,Ceramic Capacitor DWM3000 Decoupling,Murata,GRM188R71C105KA12D,0603,⚠ MAX 2mm from each DWM3000 VDD pin — tight placement critical for UWB stability.,DWM3000 VDD pin decoupling.\n34,2,C21-C22,22µF/10V X5R 1206,Ceramic Capacitor Buck Input,Murata,GRM31CR61A226KE19L,1206,⚠ MAX 3mm from TPS54331 VIN pin(Pin8).,Buck converter input capacitors.\n35,2,C23-C24,4.7µF/50V X7R 0805,Ceramic Capacitor Buck Output,Murata,GRM21BR71H475KA12L,0805,⚠ MAX 3mm from 3V3 output rail after inductor L1.,Buck converter output capacitors.\n36,2,C25-C26,10µF/6.3V X5R 0805,Ceramic Capacitor 1.8V LDO Input,Murata,GRM21BR60J106ME39L,0805,⚠ MAX 2mm from TPS780180 IN pin.,1.8V LDO input capacitors.\n37,2,C27-C28,100nF/16V X7R 0603,Ceramic Capacitor 1.8V LDO Output,Murata,GRM188R71C104KA93D,0603,⚠ MAX 1mm from TPS780180 OUT pin — very tight.,1.8V LDO output decoupling.\n38,2,C29-C30,100nF/16V X7R 0603,Ceramic Capacitor TXB0104 Decoupling,Murata,GRM188R71C104KA93D,0603,\"⚠ C29 MAX 1mm from TXB0104 VCCA(Pin1). C3